{
  "schema_version": 2,
  "cohort_id": "self-bootstrap-effectiveness-v2",
  "cell_id": "rp-01-lineage-disconnected::treatment",
  "arm": "treatment",
  "attempt_id": "s15-826c5c2a",
  "attempt_ordinal": 1,
  "freeze_sha256": "d4244d161de5765e6aa79212e35fd04d90be1868c3151cbab20c7987a985a7de",
  "allocation_ledger_sha256": "9f2dc4bf2b5a69ddd69940dd7ec77fb352733e0defedc8c1b74e6e2e570421d4",
  "packet_set_sha256": "913d143b628d681a1a959e2eae6d4c41a22f2bb61ff4eaa6ab280e9f07ab6422",
  "subject_packet_sha256": "PLACEHOLDER",
  "baseline": {
    "git_commit": "722cceed959e8ac9c45cdfd519a4c387e614c58f",
    "git_tree": "f28c8500c7f4f5223234e87d1b0d2376fbb9539a"
  },
  "identities": {
    "planned_session_id": "s15-826c5c2a",
    "planned_worktree_id": "PLACEHOLDER",
    "planned_context_id": "PLACEHOLDER",
    "native_agent_id": "host-observed-unsigned",
    "observed_harness_session_id": "PLACEHOLDER",
    "observed_cwd": "D:\\Github\\Science\\dogfood\\framework-self-study\\experiments\\self-bootstrap-effectiveness-v2\\staging",
    "observed_head_commit": "722cceed959e8ac9c45cdfd519a4c387e614c58f",
    "observed_head_tree": "f28c8500c7f4f5223234e87d1b0d2376fbb9539a"
  },
  "local_evidence": {
    "evidence_level": "host-observed-unsigned",
    "harness_receipt_sha256": null,
    "local_dispatch_acceptance_sha256": null,
    "execution_gate_sha256": null
  },
  "timing": {
    "bootstrap_started_utc": "2026-08-01T17:20:29.223198+00:00",
    "task_received_utc": "2026-08-01T17:20:29.223201+00:00",
    "ended_utc": "2026-08-01T17:20:29.223202+00:00",
    "bootstrap_elapsed_seconds": 0,
    "task_elapsed_seconds": 0
  },
  "task_evidence_started": true,
  "evidence_manifest": {
    "schema_version": 2,
    "attempt_id": "s15-826c5c2a",
    "artifacts": [
      {
        "kind": "outputs",
        "path": "s15-826c5c2a/outputs.json",
        "sha256": "febe0057fa5a8da425815e565494bc44c539c1e6562e2728a9164b561e4b1465",
        "byte_count": 675
      },
      {
        "kind": "tests",
        "path": "s15-826c5c2a/tests.json",
        "sha256": "28f0941cb81a8a88aa8b8234b76cf45c217d0541332272c4a8a52e926b14c8f9",
        "byte_count": 105
      }
    ],
    "manifest_sha256": "d9ddf50a1ecefdac9c4c0ffa5ffca8e897d600b96180184071b77c2721d85526"
  },
  "stop_reason": "completed",
  "censor": {
    "status": "not-censored",
    "reason": null
  },
  "deviations": [
    "missing-bootstrap-artifacts"
  ],
  "critical_violations": [],
  "finalized_sha256": "b1aca3aaec3e5998ee2f920cbc1b9d5a594f60aaee631dd4b5bf5e86c2dd562e"
}