{
  "schema_version": 2,
  "cohort_id": "self-bootstrap-effectiveness-v2",
  "cell_id": "cs-03-run-stop-reason::treatment",
  "arm": "treatment",
  "attempt_id": "s24-35b5c528",
  "attempt_ordinal": 1,
  "freeze_sha256": "d4244d161de5765e6aa79212e35fd04d90be1868c3151cbab20c7987a985a7de",
  "allocation_ledger_sha256": "9f2dc4bf2b5a69ddd69940dd7ec77fb352733e0defedc8c1b74e6e2e570421d4",
  "packet_set_sha256": "913d143b628d681a1a959e2eae6d4c41a22f2bb61ff4eaa6ab280e9f07ab6422",
  "subject_packet_sha256": "PLACEHOLDER",
  "baseline": {
    "git_commit": "722cceed959e8ac9c45cdfd519a4c387e614c58f",
    "git_tree": "f28c8500c7f4f5223234e87d1b0d2376fbb9539a"
  },
  "identities": {
    "planned_session_id": "s24-35b5c528",
    "planned_worktree_id": "PLACEHOLDER",
    "planned_context_id": "PLACEHOLDER",
    "native_agent_id": "host-observed-unsigned",
    "observed_harness_session_id": "PLACEHOLDER",
    "observed_cwd": "D:\\Github\\Science\\dogfood\\framework-self-study\\experiments\\self-bootstrap-effectiveness-v2\\staging",
    "observed_head_commit": "722cceed959e8ac9c45cdfd519a4c387e614c58f",
    "observed_head_tree": "f28c8500c7f4f5223234e87d1b0d2376fbb9539a"
  },
  "local_evidence": {
    "evidence_level": "host-observed-unsigned",
    "harness_receipt_sha256": null,
    "local_dispatch_acceptance_sha256": null,
    "execution_gate_sha256": null
  },
  "timing": {
    "bootstrap_started_utc": "2026-08-01T17:24:10.374875+00:00",
    "task_received_utc": "2026-08-01T17:24:10.374878+00:00",
    "ended_utc": "2026-08-01T17:24:10.374879+00:00",
    "bootstrap_elapsed_seconds": 0,
    "task_elapsed_seconds": 0
  },
  "task_evidence_started": true,
  "evidence_manifest": {
    "schema_version": 2,
    "attempt_id": "s24-35b5c528",
    "artifacts": [
      {
        "kind": "outputs",
        "path": "s24-35b5c528/outputs.json",
        "sha256": "3cffd370a31d6c319a1cd6982133e9209ff733e8ff9e7b47c0d839056bc4b563",
        "byte_count": 1684
      },
      {
        "kind": "tests",
        "path": "s24-35b5c528/tests.json",
        "sha256": "0eebb5492697f480c9b83caf5c2c9c51352bb0a1d4d2ee30543eba53f482f16e",
        "byte_count": 416
      }
    ],
    "manifest_sha256": "c6d14fa886ceb645662ae363016f9e881a9e116999927c207e4ba1efe32be17f"
  },
  "stop_reason": "completed",
  "censor": {
    "status": "not-censored",
    "reason": null
  },
  "deviations": [
    "missing-bootstrap-artifacts"
  ],
  "critical_violations": [],
  "finalized_sha256": "14ca5a1d2929e4f82c7fefe9ea5f07f487ea5204ce25f1be7f976fbd47f241d7"
}