{
  "schema_version": 2,
  "cohort_id": "self-bootstrap-effectiveness-v2",
  "cell_id": "cs-02-campaign-effort::treatment",
  "arm": "treatment",
  "attempt_id": "s04-2e4bc6a6",
  "attempt_ordinal": 1,
  "freeze_sha256": "d4244d161de5765e6aa79212e35fd04d90be1868c3151cbab20c7987a985a7de",
  "allocation_ledger_sha256": "9f2dc4bf2b5a69ddd69940dd7ec77fb352733e0defedc8c1b74e6e2e570421d4",
  "packet_set_sha256": "913d143b628d681a1a959e2eae6d4c41a22f2bb61ff4eaa6ab280e9f07ab6422",
  "subject_packet_sha256": "PLACEHOLDER",
  "baseline": {
    "git_commit": "722cceed959e8ac9c45cdfd519a4c387e614c58f",
    "git_tree": "f28c8500c7f4f5223234e87d1b0d2376fbb9539a"
  },
  "identities": {
    "planned_session_id": "s04-2e4bc6a6",
    "planned_worktree_id": "PLACEHOLDER",
    "planned_context_id": "PLACEHOLDER",
    "native_agent_id": "host-observed-unsigned",
    "observed_harness_session_id": "PLACEHOLDER",
    "observed_cwd": "D:\\Github\\Science\\dogfood\\framework-self-study\\experiments\\self-bootstrap-effectiveness-v2\\staging",
    "observed_head_commit": "722cceed959e8ac9c45cdfd519a4c387e614c58f",
    "observed_head_tree": "f28c8500c7f4f5223234e87d1b0d2376fbb9539a"
  },
  "local_evidence": {
    "evidence_level": "host-observed-unsigned",
    "harness_receipt_sha256": null,
    "local_dispatch_acceptance_sha256": null,
    "execution_gate_sha256": null
  },
  "timing": {
    "bootstrap_started_utc": "2026-08-01T17:20:29.220845+00:00",
    "task_received_utc": "2026-08-01T17:20:29.220848+00:00",
    "ended_utc": "2026-08-01T17:20:29.220849+00:00",
    "bootstrap_elapsed_seconds": 0,
    "task_elapsed_seconds": 0
  },
  "task_evidence_started": true,
  "evidence_manifest": {
    "schema_version": 2,
    "attempt_id": "s04-2e4bc6a6",
    "artifacts": [
      {
        "kind": "outputs",
        "path": "s04-2e4bc6a6/outputs.json",
        "sha256": "1ba8a01861c4811e5d04f51a8d8c588138170b8414e9fcef6dca38953c3d7100",
        "byte_count": 654
      },
      {
        "kind": "tests",
        "path": "s04-2e4bc6a6/tests.json",
        "sha256": "fdb74ec7b7390d58c7049bc28d0d4ceb03aea66325a131035b98c0a408fa25d0",
        "byte_count": 105
      }
    ],
    "manifest_sha256": "2512a2f1cf22fd934225cefa19ef7f205d06afc8a66e8224b8f135031d4e66f7"
  },
  "stop_reason": "completed",
  "censor": {
    "status": "not-censored",
    "reason": null
  },
  "deviations": [
    "missing-bootstrap-artifacts"
  ],
  "critical_violations": [],
  "finalized_sha256": "3f5e194e80a89ce3a3cf3d0b578fde5039d2d5048c798d9624b05825b74576d8"
}