{
  "schema_version": 2,
  "cohort_id": "self-bootstrap-effectiveness-v2",
  "cell_id": "or-03-coordinator-event-sequence::treatment",
  "arm": "treatment",
  "attempt_id": "s05-ea85056c",
  "attempt_ordinal": 1,
  "freeze_sha256": "d4244d161de5765e6aa79212e35fd04d90be1868c3151cbab20c7987a985a7de",
  "allocation_ledger_sha256": "9f2dc4bf2b5a69ddd69940dd7ec77fb352733e0defedc8c1b74e6e2e570421d4",
  "packet_set_sha256": "913d143b628d681a1a959e2eae6d4c41a22f2bb61ff4eaa6ab280e9f07ab6422",
  "subject_packet_sha256": "PLACEHOLDER",
  "baseline": {
    "git_commit": "722cceed959e8ac9c45cdfd519a4c387e614c58f",
    "git_tree": "f28c8500c7f4f5223234e87d1b0d2376fbb9539a"
  },
  "identities": {
    "planned_session_id": "s05-ea85056c",
    "planned_worktree_id": "PLACEHOLDER",
    "planned_context_id": "PLACEHOLDER",
    "native_agent_id": "host-observed-unsigned",
    "observed_harness_session_id": "PLACEHOLDER",
    "observed_cwd": "D:\\Github\\Science\\dogfood\\framework-self-study\\experiments\\self-bootstrap-effectiveness-v2\\staging",
    "observed_head_commit": "722cceed959e8ac9c45cdfd519a4c387e614c58f",
    "observed_head_tree": "f28c8500c7f4f5223234e87d1b0d2376fbb9539a"
  },
  "local_evidence": {
    "evidence_level": "host-observed-unsigned",
    "harness_receipt_sha256": null,
    "local_dispatch_acceptance_sha256": null,
    "execution_gate_sha256": null
  },
  "timing": {
    "bootstrap_started_utc": "2026-08-01T17:20:29.221045+00:00",
    "task_received_utc": "2026-08-01T17:20:29.221048+00:00",
    "ended_utc": "2026-08-01T17:20:29.221049+00:00",
    "bootstrap_elapsed_seconds": 0,
    "task_elapsed_seconds": 0
  },
  "task_evidence_started": true,
  "evidence_manifest": {
    "schema_version": 2,
    "attempt_id": "s05-ea85056c",
    "artifacts": [
      {
        "kind": "outputs",
        "path": "s05-ea85056c/outputs.json",
        "sha256": "6b1bec4b2363cc0f16fd474bc59d86f633c78a0ea2bf52d387c5933fa4314ea6",
        "byte_count": 752
      },
      {
        "kind": "tests",
        "path": "s05-ea85056c/tests.json",
        "sha256": "9b6f4befca96cd5c6ae3c3830c479b7e1039c8f60ab172fd2ef58372b3778c48",
        "byte_count": 113
      }
    ],
    "manifest_sha256": "4cc7a14cadf3e335348b3c0a75c08ceb1dca2c7795dea2ef790ae5a467ec8b13"
  },
  "stop_reason": "completed",
  "censor": {
    "status": "not-censored",
    "reason": null
  },
  "deviations": [
    "missing-bootstrap-artifacts"
  ],
  "critical_violations": [],
  "finalized_sha256": "dfcd05090c15edd797ae94158ca8cebcae3c956f64bf9354ebf400e8d2019d16"
}