{
  "schema_version": 2,
  "cohort_id": "self-bootstrap-effectiveness-v2",
  "cell_id": "dx-02-campaign-explain::control",
  "arm": "control",
  "attempt_id": "s22-b057ca3b",
  "attempt_ordinal": 1,
  "freeze_sha256": "d4244d161de5765e6aa79212e35fd04d90be1868c3151cbab20c7987a985a7de",
  "allocation_ledger_sha256": "9f2dc4bf2b5a69ddd69940dd7ec77fb352733e0defedc8c1b74e6e2e570421d4",
  "packet_set_sha256": "913d143b628d681a1a959e2eae6d4c41a22f2bb61ff4eaa6ab280e9f07ab6422",
  "subject_packet_sha256": "PLACEHOLDER",
  "baseline": {
    "git_commit": "722cceed959e8ac9c45cdfd519a4c387e614c58f",
    "git_tree": "f28c8500c7f4f5223234e87d1b0d2376fbb9539a"
  },
  "identities": {
    "planned_session_id": "s22-b057ca3b",
    "planned_worktree_id": "PLACEHOLDER",
    "planned_context_id": "PLACEHOLDER",
    "native_agent_id": "host-observed-unsigned",
    "observed_harness_session_id": "PLACEHOLDER",
    "observed_cwd": "D:\\Github\\Science\\dogfood\\framework-self-study\\experiments\\self-bootstrap-effectiveness-v2\\staging",
    "observed_head_commit": "722cceed959e8ac9c45cdfd519a4c387e614c58f",
    "observed_head_tree": "f28c8500c7f4f5223234e87d1b0d2376fbb9539a"
  },
  "local_evidence": {
    "evidence_level": "host-observed-unsigned",
    "harness_receipt_sha256": null,
    "local_dispatch_acceptance_sha256": null,
    "execution_gate_sha256": null
  },
  "timing": {
    "bootstrap_started_utc": "2026-08-01T17:24:10.374412+00:00",
    "task_received_utc": "2026-08-01T17:24:10.374415+00:00",
    "ended_utc": "2026-08-01T17:24:10.374416+00:00",
    "bootstrap_elapsed_seconds": 0,
    "task_elapsed_seconds": 0
  },
  "task_evidence_started": true,
  "evidence_manifest": {
    "schema_version": 2,
    "attempt_id": "s22-b057ca3b",
    "artifacts": [
      {
        "kind": "outputs",
        "path": "s22-b057ca3b/outputs.json",
        "sha256": "674f5c161ab18d2c3ef8c04a0c7012e98e20514a33c4a5f89088dd5f51bf9719",
        "byte_count": 1769
      },
      {
        "kind": "tests",
        "path": "s22-b057ca3b/tests.json",
        "sha256": "1c264af32d1a135fa1a874221f7c825ca005d8d97da9a570f6f4e0f677ba983f",
        "byte_count": 288
      }
    ],
    "manifest_sha256": "986d2a2ceacab9720678bef893b03bf3c8ccaf568e5358bf2e385583ef681f2c"
  },
  "stop_reason": "completed",
  "censor": {
    "status": "not-censored",
    "reason": null
  },
  "deviations": [
    "missing-bootstrap-artifacts"
  ],
  "critical_violations": [],
  "finalized_sha256": "5a047339f48cc61196500f0b01e68652ae7ad864dd3eb21bbd4be995c9dd30c9"
}