{
  "schema_version": 2,
  "cohort_id": "self-bootstrap-effectiveness-v2",
  "cell_id": "or-02-handoff-output-uniqueness::treatment",
  "arm": "treatment",
  "attempt_id": "s18-0797a08d",
  "attempt_ordinal": 1,
  "freeze_sha256": "d4244d161de5765e6aa79212e35fd04d90be1868c3151cbab20c7987a985a7de",
  "allocation_ledger_sha256": "9f2dc4bf2b5a69ddd69940dd7ec77fb352733e0defedc8c1b74e6e2e570421d4",
  "packet_set_sha256": "913d143b628d681a1a959e2eae6d4c41a22f2bb61ff4eaa6ab280e9f07ab6422",
  "subject_packet_sha256": "PLACEHOLDER",
  "baseline": {
    "git_commit": "722cceed959e8ac9c45cdfd519a4c387e614c58f",
    "git_tree": "f28c8500c7f4f5223234e87d1b0d2376fbb9539a"
  },
  "identities": {
    "planned_session_id": "s18-0797a08d",
    "planned_worktree_id": "PLACEHOLDER",
    "planned_context_id": "PLACEHOLDER",
    "native_agent_id": "host-observed-unsigned",
    "observed_harness_session_id": "PLACEHOLDER",
    "observed_cwd": "D:\\Github\\Science\\dogfood\\framework-self-study\\experiments\\self-bootstrap-effectiveness-v2\\staging",
    "observed_head_commit": "722cceed959e8ac9c45cdfd519a4c387e614c58f",
    "observed_head_tree": "f28c8500c7f4f5223234e87d1b0d2376fbb9539a"
  },
  "local_evidence": {
    "evidence_level": "host-observed-unsigned",
    "harness_receipt_sha256": null,
    "local_dispatch_acceptance_sha256": null,
    "execution_gate_sha256": null
  },
  "timing": {
    "bootstrap_started_utc": "2026-08-01T17:20:29.223803+00:00",
    "task_received_utc": "2026-08-01T17:20:29.223806+00:00",
    "ended_utc": "2026-08-01T17:20:29.223807+00:00",
    "bootstrap_elapsed_seconds": 0,
    "task_elapsed_seconds": 0
  },
  "task_evidence_started": true,
  "evidence_manifest": {
    "schema_version": 2,
    "attempt_id": "s18-0797a08d",
    "artifacts": [
      {
        "kind": "outputs",
        "path": "s18-0797a08d/outputs.json",
        "sha256": "9f091bf6c445dbc9df84d43dd6d1437e0b95925e03b9899616231e7947714848",
        "byte_count": 706
      },
      {
        "kind": "tests",
        "path": "s18-0797a08d/tests.json",
        "sha256": "af2bb3c727b63640dde6c0816a55299a6751f53618d84b886fbbc0abfe02731e",
        "byte_count": 59
      }
    ],
    "manifest_sha256": "90b8d520e96c656affb4bccdd96a48c9aa566e51b0a07c77541904e94f826e8a"
  },
  "stop_reason": "completed",
  "censor": {
    "status": "not-censored",
    "reason": null
  },
  "deviations": [
    "missing-bootstrap-artifacts"
  ],
  "critical_violations": [],
  "finalized_sha256": "580cdb9db0a944c060f663bab9f175602e607fd2c160c3d9d7b919440ce95282"
}