{
  "schema_version": 2,
  "cohort_id": "self-bootstrap-effectiveness-v2",
  "cell_id": "cs-01-experiment-metadata::treatment",
  "arm": "treatment",
  "attempt_id": "s20-2c5c522c",
  "attempt_ordinal": 1,
  "freeze_sha256": "d4244d161de5765e6aa79212e35fd04d90be1868c3151cbab20c7987a985a7de",
  "allocation_ledger_sha256": "9f2dc4bf2b5a69ddd69940dd7ec77fb352733e0defedc8c1b74e6e2e570421d4",
  "packet_set_sha256": "913d143b628d681a1a959e2eae6d4c41a22f2bb61ff4eaa6ab280e9f07ab6422",
  "subject_packet_sha256": "PLACEHOLDER",
  "baseline": {
    "git_commit": "722cceed959e8ac9c45cdfd519a4c387e614c58f",
    "git_tree": "f28c8500c7f4f5223234e87d1b0d2376fbb9539a"
  },
  "identities": {
    "planned_session_id": "s20-2c5c522c",
    "planned_worktree_id": "PLACEHOLDER",
    "planned_context_id": "PLACEHOLDER",
    "native_agent_id": "host-observed-unsigned",
    "observed_harness_session_id": "PLACEHOLDER",
    "observed_cwd": "D:\\Github\\Science\\dogfood\\framework-self-study\\experiments\\self-bootstrap-effectiveness-v2\\staging",
    "observed_head_commit": "722cceed959e8ac9c45cdfd519a4c387e614c58f",
    "observed_head_tree": "f28c8500c7f4f5223234e87d1b0d2376fbb9539a"
  },
  "local_evidence": {
    "evidence_level": "host-observed-unsigned",
    "harness_receipt_sha256": null,
    "local_dispatch_acceptance_sha256": null,
    "execution_gate_sha256": null
  },
  "timing": {
    "bootstrap_started_utc": "2026-08-01T17:20:29.224202+00:00",
    "task_received_utc": "2026-08-01T17:20:29.224204+00:00",
    "ended_utc": "2026-08-01T17:20:29.224205+00:00",
    "bootstrap_elapsed_seconds": 0,
    "task_elapsed_seconds": 0
  },
  "task_evidence_started": true,
  "evidence_manifest": {
    "schema_version": 2,
    "attempt_id": "s20-2c5c522c",
    "artifacts": [
      {
        "kind": "outputs",
        "path": "s20-2c5c522c/outputs.json",
        "sha256": "9177eb394786bbbea5049ff1bf9bac2af775c445477bd48b5d270cb7f2188ccf",
        "byte_count": 720
      },
      {
        "kind": "tests",
        "path": "s20-2c5c522c/tests.json",
        "sha256": "57d2088e25c6d9ff742be5d8ffaa4c77f11d3729cf2a26d70bceb122165555c0",
        "byte_count": 82
      }
    ],
    "manifest_sha256": "85a6cef041473f76b3d5c67687a673161623064f2631ff3d80104534ff76a9aa"
  },
  "stop_reason": "completed",
  "censor": {
    "status": "not-censored",
    "reason": null
  },
  "deviations": [
    "missing-bootstrap-artifacts"
  ],
  "critical_violations": [],
  "finalized_sha256": "e2b9ba68feec9799a61d1d5f3181f83f717f5488ba7c746e68b84c01cee474ab"
}