{
  "schema_version": 2,
  "cohort_id": "self-bootstrap-effectiveness-v2",
  "cell_id": "rp-02-environment-size-cap::treatment",
  "arm": "treatment",
  "attempt_id": "s17-1183fc00",
  "attempt_ordinal": 1,
  "freeze_sha256": "d4244d161de5765e6aa79212e35fd04d90be1868c3151cbab20c7987a985a7de",
  "allocation_ledger_sha256": "9f2dc4bf2b5a69ddd69940dd7ec77fb352733e0defedc8c1b74e6e2e570421d4",
  "packet_set_sha256": "913d143b628d681a1a959e2eae6d4c41a22f2bb61ff4eaa6ab280e9f07ab6422",
  "subject_packet_sha256": "PLACEHOLDER",
  "baseline": {
    "git_commit": "722cceed959e8ac9c45cdfd519a4c387e614c58f",
    "git_tree": "f28c8500c7f4f5223234e87d1b0d2376fbb9539a"
  },
  "identities": {
    "planned_session_id": "s17-1183fc00",
    "planned_worktree_id": "PLACEHOLDER",
    "planned_context_id": "PLACEHOLDER",
    "native_agent_id": "host-observed-unsigned",
    "observed_harness_session_id": "PLACEHOLDER",
    "observed_cwd": "D:\\Github\\Science\\dogfood\\framework-self-study\\experiments\\self-bootstrap-effectiveness-v2\\staging",
    "observed_head_commit": "722cceed959e8ac9c45cdfd519a4c387e614c58f",
    "observed_head_tree": "f28c8500c7f4f5223234e87d1b0d2376fbb9539a"
  },
  "local_evidence": {
    "evidence_level": "host-observed-unsigned",
    "harness_receipt_sha256": null,
    "local_dispatch_acceptance_sha256": null,
    "execution_gate_sha256": null
  },
  "timing": {
    "bootstrap_started_utc": "2026-08-01T17:24:10.373334+00:00",
    "task_received_utc": "2026-08-01T17:24:10.373337+00:00",
    "ended_utc": "2026-08-01T17:24:10.373338+00:00",
    "bootstrap_elapsed_seconds": 0,
    "task_elapsed_seconds": 0
  },
  "task_evidence_started": true,
  "evidence_manifest": {
    "schema_version": 2,
    "attempt_id": "s17-1183fc00",
    "artifacts": [
      {
        "kind": "outputs",
        "path": "s17-1183fc00/outputs.json",
        "sha256": "522c8dcdeb44ca47661ec8d7d0dd0a4996c49348682699b11221154588992183",
        "byte_count": 882
      },
      {
        "kind": "tests",
        "path": "s17-1183fc00/tests.json",
        "sha256": "7f9bc6d04bc31e0271d5b22112a0e8f4023822412db33880fe6e740ab192158f",
        "byte_count": 98
      }
    ],
    "manifest_sha256": "7d7e5f3ffd0007fd5ad391f506af77c1b8c9fea6cf52779777a679a33ea65d5e"
  },
  "stop_reason": "completed",
  "censor": {
    "status": "not-censored",
    "reason": null
  },
  "deviations": [
    "missing-bootstrap-artifacts"
  ],
  "critical_violations": [],
  "finalized_sha256": "d472310f48220abb62008a503e9cef19efb0c1e453d1de85d6f7ae55ff21de12"
}