{
  "schema_version": 2,
  "cohort_id": "self-bootstrap-effectiveness-v2",
  "cell_id": "dx-01-validation-json::treatment",
  "arm": "treatment",
  "attempt_id": "s19-e5ed0fe8",
  "attempt_ordinal": 1,
  "freeze_sha256": "d4244d161de5765e6aa79212e35fd04d90be1868c3151cbab20c7987a985a7de",
  "allocation_ledger_sha256": "9f2dc4bf2b5a69ddd69940dd7ec77fb352733e0defedc8c1b74e6e2e570421d4",
  "packet_set_sha256": "913d143b628d681a1a959e2eae6d4c41a22f2bb61ff4eaa6ab280e9f07ab6422",
  "subject_packet_sha256": "PLACEHOLDER",
  "baseline": {
    "git_commit": "722cceed959e8ac9c45cdfd519a4c387e614c58f",
    "git_tree": "f28c8500c7f4f5223234e87d1b0d2376fbb9539a"
  },
  "identities": {
    "planned_session_id": "s19-e5ed0fe8",
    "planned_worktree_id": "PLACEHOLDER",
    "planned_context_id": "PLACEHOLDER",
    "native_agent_id": "host-observed-unsigned",
    "observed_harness_session_id": "PLACEHOLDER",
    "observed_cwd": "D:\\Github\\Science\\dogfood\\framework-self-study\\experiments\\self-bootstrap-effectiveness-v2\\staging",
    "observed_head_commit": "722cceed959e8ac9c45cdfd519a4c387e614c58f",
    "observed_head_tree": "f28c8500c7f4f5223234e87d1b0d2376fbb9539a"
  },
  "local_evidence": {
    "evidence_level": "host-observed-unsigned",
    "harness_receipt_sha256": null,
    "local_dispatch_acceptance_sha256": null,
    "execution_gate_sha256": null
  },
  "timing": {
    "bootstrap_started_utc": "2026-08-01T17:24:10.373745+00:00",
    "task_received_utc": "2026-08-01T17:24:10.373748+00:00",
    "ended_utc": "2026-08-01T17:24:10.373749+00:00",
    "bootstrap_elapsed_seconds": 0,
    "task_elapsed_seconds": 0
  },
  "task_evidence_started": true,
  "evidence_manifest": {
    "schema_version": 2,
    "attempt_id": "s19-e5ed0fe8",
    "artifacts": [
      {
        "kind": "outputs",
        "path": "s19-e5ed0fe8/outputs.json",
        "sha256": "40a9a4cc206bb93b2bdb59b5abd8ca59cd1481bf0fbdef0c1f89f972c8ed8159",
        "byte_count": 664
      },
      {
        "kind": "tests",
        "path": "s19-e5ed0fe8/tests.json",
        "sha256": "cc83e257403fe78b74e22dcff8fa696ac3ac67396baef7cab799a74e146ad343",
        "byte_count": 58
      }
    ],
    "manifest_sha256": "e3b0f9d5f76f39cb6f4f321c32419ce4a4fa037f4547d52ed164b42340a7cbb4"
  },
  "stop_reason": "completed",
  "censor": {
    "status": "not-censored",
    "reason": null
  },
  "deviations": [
    "missing-bootstrap-artifacts"
  ],
  "critical_violations": [],
  "finalized_sha256": "2e4960a2450f93b73ce1d7b5148c67873740977dd314b0e8b0309fb150fbe977"
}