{
  "schema_version": 2,
  "cohort_id": "self-bootstrap-effectiveness-v2",
  "cell_id": "or-01-scheduler-capacity::treatment",
  "arm": "treatment",
  "attempt_id": "s10-fce59dae",
  "attempt_ordinal": 1,
  "freeze_sha256": "d4244d161de5765e6aa79212e35fd04d90be1868c3151cbab20c7987a985a7de",
  "allocation_ledger_sha256": "9f2dc4bf2b5a69ddd69940dd7ec77fb352733e0defedc8c1b74e6e2e570421d4",
  "packet_set_sha256": "913d143b628d681a1a959e2eae6d4c41a22f2bb61ff4eaa6ab280e9f07ab6422",
  "subject_packet_sha256": "PLACEHOLDER",
  "baseline": {
    "git_commit": "722cceed959e8ac9c45cdfd519a4c387e614c58f",
    "git_tree": "f28c8500c7f4f5223234e87d1b0d2376fbb9539a"
  },
  "identities": {
    "planned_session_id": "s10-fce59dae",
    "planned_worktree_id": "PLACEHOLDER",
    "planned_context_id": "PLACEHOLDER",
    "native_agent_id": "host-observed-unsigned",
    "observed_harness_session_id": "PLACEHOLDER",
    "observed_cwd": "D:\\Github\\Science\\dogfood\\framework-self-study\\experiments\\self-bootstrap-effectiveness-v2\\staging",
    "observed_head_commit": "722cceed959e8ac9c45cdfd519a4c387e614c58f",
    "observed_head_tree": "f28c8500c7f4f5223234e87d1b0d2376fbb9539a"
  },
  "local_evidence": {
    "evidence_level": "host-observed-unsigned",
    "harness_receipt_sha256": null,
    "local_dispatch_acceptance_sha256": null,
    "execution_gate_sha256": null
  },
  "timing": {
    "bootstrap_started_utc": "2026-08-01T17:20:29.222196+00:00",
    "task_received_utc": "2026-08-01T17:20:29.222200+00:00",
    "ended_utc": "2026-08-01T17:20:29.222201+00:00",
    "bootstrap_elapsed_seconds": 0,
    "task_elapsed_seconds": 0
  },
  "task_evidence_started": true,
  "evidence_manifest": {
    "schema_version": 2,
    "attempt_id": "s10-fce59dae",
    "artifacts": [
      {
        "kind": "outputs",
        "path": "s10-fce59dae/outputs.json",
        "sha256": "0ac016af3dc002a656f394e8053980556818bf3a513e0877887675a26fc0a887",
        "byte_count": 719
      },
      {
        "kind": "tests",
        "path": "s10-fce59dae/tests.json",
        "sha256": "fa0e6b23b7b8706dfcdc9ee49948cc93a7c2edce06446178e4afb768258f5c85",
        "byte_count": 61
      }
    ],
    "manifest_sha256": "146e67e09edaded05baab2d05123f8f990e2660f17ba3142923ba62c9e6372c4"
  },
  "stop_reason": "completed",
  "censor": {
    "status": "not-censored",
    "reason": null
  },
  "deviations": [
    "missing-bootstrap-artifacts"
  ],
  "critical_violations": [],
  "finalized_sha256": "206987427ee6d50e3f3bd4076015f9e3516efa44888c9c04512e1f5c3556c924"
}