{
  "schema_version": 2,
  "cohort_id": "self-bootstrap-effectiveness-v2",
  "cell_id": "or-01-scheduler-capacity::control",
  "arm": "control",
  "attempt_id": "s12-3aeb315a",
  "attempt_ordinal": 1,
  "freeze_sha256": "d4244d161de5765e6aa79212e35fd04d90be1868c3151cbab20c7987a985a7de",
  "allocation_ledger_sha256": "9f2dc4bf2b5a69ddd69940dd7ec77fb352733e0defedc8c1b74e6e2e570421d4",
  "packet_set_sha256": "913d143b628d681a1a959e2eae6d4c41a22f2bb61ff4eaa6ab280e9f07ab6422",
  "subject_packet_sha256": "PLACEHOLDER",
  "baseline": {
    "git_commit": "722cceed959e8ac9c45cdfd519a4c387e614c58f",
    "git_tree": "f28c8500c7f4f5223234e87d1b0d2376fbb9539a"
  },
  "identities": {
    "planned_session_id": "s12-3aeb315a",
    "planned_worktree_id": "PLACEHOLDER",
    "planned_context_id": "PLACEHOLDER",
    "native_agent_id": "host-observed-unsigned",
    "observed_harness_session_id": "PLACEHOLDER",
    "observed_cwd": "D:\\Github\\Science\\dogfood\\framework-self-study\\experiments\\self-bootstrap-effectiveness-v2\\staging",
    "observed_head_commit": "722cceed959e8ac9c45cdfd519a4c387e614c58f",
    "observed_head_tree": "f28c8500c7f4f5223234e87d1b0d2376fbb9539a"
  },
  "local_evidence": {
    "evidence_level": "host-observed-unsigned",
    "harness_receipt_sha256": null,
    "local_dispatch_acceptance_sha256": null,
    "execution_gate_sha256": null
  },
  "timing": {
    "bootstrap_started_utc": "2026-08-01T17:24:10.372245+00:00",
    "task_received_utc": "2026-08-01T17:24:10.372248+00:00",
    "ended_utc": "2026-08-01T17:24:10.372249+00:00",
    "bootstrap_elapsed_seconds": 0,
    "task_elapsed_seconds": 0
  },
  "task_evidence_started": true,
  "evidence_manifest": {
    "schema_version": 2,
    "attempt_id": "s12-3aeb315a",
    "artifacts": [
      {
        "kind": "outputs",
        "path": "s12-3aeb315a/outputs.json",
        "sha256": "6f2adc067efb666cd9f9c92c97ef6a87721d48147777cb16fbd51dddcb53964b",
        "byte_count": 629
      },
      {
        "kind": "tests",
        "path": "s12-3aeb315a/tests.json",
        "sha256": "fa0e6b23b7b8706dfcdc9ee49948cc93a7c2edce06446178e4afb768258f5c85",
        "byte_count": 61
      }
    ],
    "manifest_sha256": "de234c368d6f42ea2de30736512b180761eb81810175a889512bfefdceea6031"
  },
  "stop_reason": "completed",
  "censor": {
    "status": "not-censored",
    "reason": null
  },
  "deviations": [
    "missing-bootstrap-artifacts"
  ],
  "critical_violations": [],
  "finalized_sha256": "d5184ee110ced47f05df275aa327bc95007cdb275c32a75a03e1a1931fbaad87"
}