{
  "schema_version": 2,
  "cohort_id": "self-bootstrap-effectiveness-v2",
  "cell_id": "dx-02-campaign-explain::treatment",
  "arm": "treatment",
  "attempt_id": "s13-74687a47",
  "attempt_ordinal": 1,
  "freeze_sha256": "d4244d161de5765e6aa79212e35fd04d90be1868c3151cbab20c7987a985a7de",
  "allocation_ledger_sha256": "9f2dc4bf2b5a69ddd69940dd7ec77fb352733e0defedc8c1b74e6e2e570421d4",
  "packet_set_sha256": "913d143b628d681a1a959e2eae6d4c41a22f2bb61ff4eaa6ab280e9f07ab6422",
  "subject_packet_sha256": "PLACEHOLDER",
  "baseline": {
    "git_commit": "722cceed959e8ac9c45cdfd519a4c387e614c58f",
    "git_tree": "f28c8500c7f4f5223234e87d1b0d2376fbb9539a"
  },
  "identities": {
    "planned_session_id": "s13-74687a47",
    "planned_worktree_id": "PLACEHOLDER",
    "planned_context_id": "PLACEHOLDER",
    "native_agent_id": "host-observed-unsigned",
    "observed_harness_session_id": "PLACEHOLDER",
    "observed_cwd": "D:\\Github\\Science\\dogfood\\framework-self-study\\experiments\\self-bootstrap-effectiveness-v2\\staging",
    "observed_head_commit": "722cceed959e8ac9c45cdfd519a4c387e614c58f",
    "observed_head_tree": "f28c8500c7f4f5223234e87d1b0d2376fbb9539a"
  },
  "local_evidence": {
    "evidence_level": "host-observed-unsigned",
    "harness_receipt_sha256": null,
    "local_dispatch_acceptance_sha256": null,
    "execution_gate_sha256": null
  },
  "timing": {
    "bootstrap_started_utc": "2026-08-01T17:20:29.222800+00:00",
    "task_received_utc": "2026-08-01T17:20:29.222803+00:00",
    "ended_utc": "2026-08-01T17:20:29.222804+00:00",
    "bootstrap_elapsed_seconds": 0,
    "task_elapsed_seconds": 0
  },
  "task_evidence_started": true,
  "evidence_manifest": {
    "schema_version": 2,
    "attempt_id": "s13-74687a47",
    "artifacts": [
      {
        "kind": "outputs",
        "path": "s13-74687a47/outputs.json",
        "sha256": "8d4a30ad36f3ea3eec25fc299790b39e8030a31f45e1321df0f36ebc7d36ff98",
        "byte_count": 804
      },
      {
        "kind": "tests",
        "path": "s13-74687a47/tests.json",
        "sha256": "c0060e41212343bbe4774c6c943b7e7b02b20fc13c7032c5e7ec268eac605aac",
        "byte_count": 104
      }
    ],
    "manifest_sha256": "b45cfe43fc713214e659d48c20bd3998ecc92ccbdda54e6118a2a0eb4a9b5ffd"
  },
  "stop_reason": "completed",
  "censor": {
    "status": "not-censored",
    "reason": null
  },
  "deviations": [
    "missing-bootstrap-artifacts"
  ],
  "critical_violations": [],
  "finalized_sha256": "3759f9a57f5400a7f1042ea5b14d7ccfb7c5c1c92e7ae2f750ad90bb95933ca5"
}