{
  "schema_version": 2,
  "cohort_id": "self-bootstrap-effectiveness-v2",
  "cell_id": "dx-03-doctor-remediation::treatment",
  "arm": "treatment",
  "attempt_id": "s06-50dbc087",
  "attempt_ordinal": 1,
  "freeze_sha256": "d4244d161de5765e6aa79212e35fd04d90be1868c3151cbab20c7987a985a7de",
  "allocation_ledger_sha256": "9f2dc4bf2b5a69ddd69940dd7ec77fb352733e0defedc8c1b74e6e2e570421d4",
  "packet_set_sha256": "913d143b628d681a1a959e2eae6d4c41a22f2bb61ff4eaa6ab280e9f07ab6422",
  "subject_packet_sha256": "PLACEHOLDER",
  "baseline": {
    "git_commit": "722cceed959e8ac9c45cdfd519a4c387e614c58f",
    "git_tree": "f28c8500c7f4f5223234e87d1b0d2376fbb9539a"
  },
  "identities": {
    "planned_session_id": "s06-50dbc087",
    "planned_worktree_id": "PLACEHOLDER",
    "planned_context_id": "PLACEHOLDER",
    "native_agent_id": "host-observed-unsigned",
    "observed_harness_session_id": "PLACEHOLDER",
    "observed_cwd": "D:\\Github\\Science\\dogfood\\framework-self-study\\experiments\\self-bootstrap-effectiveness-v2\\staging",
    "observed_head_commit": "722cceed959e8ac9c45cdfd519a4c387e614c58f",
    "observed_head_tree": "f28c8500c7f4f5223234e87d1b0d2376fbb9539a"
  },
  "local_evidence": {
    "evidence_level": "host-observed-unsigned",
    "harness_receipt_sha256": null,
    "local_dispatch_acceptance_sha256": null,
    "execution_gate_sha256": null
  },
  "timing": {
    "bootstrap_started_utc": "2026-08-01T17:24:10.371017+00:00",
    "task_received_utc": "2026-08-01T17:24:10.371020+00:00",
    "ended_utc": "2026-08-01T17:24:10.371021+00:00",
    "bootstrap_elapsed_seconds": 0,
    "task_elapsed_seconds": 0
  },
  "task_evidence_started": true,
  "evidence_manifest": {
    "schema_version": 2,
    "attempt_id": "s06-50dbc087",
    "artifacts": [
      {
        "kind": "outputs",
        "path": "s06-50dbc087/outputs.json",
        "sha256": "cd68c92229c6c6ae14904c1f3d6b49dd893dd22b635c2aa8774130b77afa72e4",
        "byte_count": 740
      },
      {
        "kind": "tests",
        "path": "s06-50dbc087/tests.json",
        "sha256": "30d3cac87af36cf9411ca35a4207dfc71943ebe870d96d6bcb0443f7106b306c",
        "byte_count": 93
      }
    ],
    "manifest_sha256": "92ee35e2c2868766a4c903f3eff05695aaee6c2410599b996e5554f3380b4817"
  },
  "stop_reason": "completed",
  "censor": {
    "status": "not-censored",
    "reason": null
  },
  "deviations": [
    "missing-bootstrap-artifacts"
  ],
  "critical_violations": [],
  "finalized_sha256": "d8581807eb8b9716d1911e793534cc1d8a45bd034225b11a5c1a72e70e6aaff1"
}