{
  "schema_version": 2,
  "cohort_id": "self-bootstrap-effectiveness-v2",
  "cell_id": "rp-02-environment-size-cap::control",
  "arm": "control",
  "attempt_id": "s23-a0962298",
  "attempt_ordinal": 1,
  "freeze_sha256": "d4244d161de5765e6aa79212e35fd04d90be1868c3151cbab20c7987a985a7de",
  "allocation_ledger_sha256": "9f2dc4bf2b5a69ddd69940dd7ec77fb352733e0defedc8c1b74e6e2e570421d4",
  "packet_set_sha256": "913d143b628d681a1a959e2eae6d4c41a22f2bb61ff4eaa6ab280e9f07ab6422",
  "subject_packet_sha256": "PLACEHOLDER",
  "baseline": {
    "git_commit": "722cceed959e8ac9c45cdfd519a4c387e614c58f",
    "git_tree": "f28c8500c7f4f5223234e87d1b0d2376fbb9539a"
  },
  "identities": {
    "planned_session_id": "s23-a0962298",
    "planned_worktree_id": "PLACEHOLDER",
    "planned_context_id": "PLACEHOLDER",
    "native_agent_id": "host-observed-unsigned",
    "observed_harness_session_id": "PLACEHOLDER",
    "observed_cwd": "D:\\Github\\Science\\dogfood\\framework-self-study\\experiments\\self-bootstrap-effectiveness-v2\\staging",
    "observed_head_commit": "722cceed959e8ac9c45cdfd519a4c387e614c58f",
    "observed_head_tree": "f28c8500c7f4f5223234e87d1b0d2376fbb9539a"
  },
  "local_evidence": {
    "evidence_level": "host-observed-unsigned",
    "harness_receipt_sha256": null,
    "local_dispatch_acceptance_sha256": null,
    "execution_gate_sha256": null
  },
  "timing": {
    "bootstrap_started_utc": "2026-08-01T17:20:29.224898+00:00",
    "task_received_utc": "2026-08-01T17:20:29.224901+00:00",
    "ended_utc": "2026-08-01T17:20:29.224902+00:00",
    "bootstrap_elapsed_seconds": 0,
    "task_elapsed_seconds": 0
  },
  "task_evidence_started": true,
  "evidence_manifest": {
    "schema_version": 2,
    "attempt_id": "s23-a0962298",
    "artifacts": [
      {
        "kind": "outputs",
        "path": "s23-a0962298/outputs.json",
        "sha256": "491dafd8e13c8340336c783d9cdaca8f08ea5a5ecc700afcfe33fc676bf1931c",
        "byte_count": 1067
      },
      {
        "kind": "tests",
        "path": "s23-a0962298/tests.json",
        "sha256": "255e8b4aebbfa2388b4ade90568bf7e9531b92d6d711da2ac37d4fee2b80b972",
        "byte_count": 219
      }
    ],
    "manifest_sha256": "f88f1df8f716786a6ba0ef231a32bda42c844c97475c021bcc52144cf0eb3495"
  },
  "stop_reason": "completed",
  "censor": {
    "status": "not-censored",
    "reason": null
  },
  "deviations": [
    "missing-bootstrap-artifacts"
  ],
  "critical_violations": [],
  "finalized_sha256": "cc378a523e865af152a13f0f71634fada3d1fa7b479fcd63574b24f31b334fd4"
}