{
  "schema_version": 2,
  "cohort_id": "self-bootstrap-effectiveness-v2",
  "cell_id": "or-02-handoff-output-uniqueness::control",
  "arm": "control",
  "attempt_id": "s08-ac171889",
  "attempt_ordinal": 1,
  "freeze_sha256": "d4244d161de5765e6aa79212e35fd04d90be1868c3151cbab20c7987a985a7de",
  "allocation_ledger_sha256": "9f2dc4bf2b5a69ddd69940dd7ec77fb352733e0defedc8c1b74e6e2e570421d4",
  "packet_set_sha256": "913d143b628d681a1a959e2eae6d4c41a22f2bb61ff4eaa6ab280e9f07ab6422",
  "subject_packet_sha256": "PLACEHOLDER",
  "baseline": {
    "git_commit": "722cceed959e8ac9c45cdfd519a4c387e614c58f",
    "git_tree": "f28c8500c7f4f5223234e87d1b0d2376fbb9539a"
  },
  "identities": {
    "planned_session_id": "s08-ac171889",
    "planned_worktree_id": "PLACEHOLDER",
    "planned_context_id": "PLACEHOLDER",
    "native_agent_id": "host-observed-unsigned",
    "observed_harness_session_id": "PLACEHOLDER",
    "observed_cwd": "D:\\Github\\Science\\dogfood\\framework-self-study\\experiments\\self-bootstrap-effectiveness-v2\\staging",
    "observed_head_commit": "722cceed959e8ac9c45cdfd519a4c387e614c58f",
    "observed_head_tree": "f28c8500c7f4f5223234e87d1b0d2376fbb9539a"
  },
  "local_evidence": {
    "evidence_level": "host-observed-unsigned",
    "harness_receipt_sha256": null,
    "local_dispatch_acceptance_sha256": null,
    "execution_gate_sha256": null
  },
  "timing": {
    "bootstrap_started_utc": "2026-08-01T17:24:10.371429+00:00",
    "task_received_utc": "2026-08-01T17:24:10.371433+00:00",
    "ended_utc": "2026-08-01T17:24:10.371434+00:00",
    "bootstrap_elapsed_seconds": 0,
    "task_elapsed_seconds": 0
  },
  "task_evidence_started": true,
  "evidence_manifest": {
    "schema_version": 2,
    "attempt_id": "s08-ac171889",
    "artifacts": [
      {
        "kind": "outputs",
        "path": "s08-ac171889/outputs.json",
        "sha256": "c4bb32c95405a296b65f4e8ba25e25b0512ed48b85b094f8ff69ba494595c721",
        "byte_count": 682
      },
      {
        "kind": "tests",
        "path": "s08-ac171889/tests.json",
        "sha256": "bad3fc58802382c7d65fb1079a5f2c74ab72187a2fd2f87929c27ddda5010776",
        "byte_count": 59
      }
    ],
    "manifest_sha256": "42f678f05dbd3341819e5278b3676bef14482aa41a17da66394139b93dc95203"
  },
  "stop_reason": "completed",
  "censor": {
    "status": "not-censored",
    "reason": null
  },
  "deviations": [
    "missing-bootstrap-artifacts"
  ],
  "critical_violations": [],
  "finalized_sha256": "9ec9815d5323912510e1bb6053344b28d726b41f728fce2e7ad85ef9ffb05d16"
}