{
  "schema_version": 2,
  "cohort_id": "self-bootstrap-effectiveness-v2",
  "cell_id": "or-03-coordinator-event-sequence::control",
  "arm": "control",
  "attempt_id": "s02-5398e11e",
  "attempt_ordinal": 1,
  "freeze_sha256": "d4244d161de5765e6aa79212e35fd04d90be1868c3151cbab20c7987a985a7de",
  "allocation_ledger_sha256": "9f2dc4bf2b5a69ddd69940dd7ec77fb352733e0defedc8c1b74e6e2e570421d4",
  "packet_set_sha256": "913d143b628d681a1a959e2eae6d4c41a22f2bb61ff4eaa6ab280e9f07ab6422",
  "subject_packet_sha256": "PLACEHOLDER",
  "baseline": {
    "git_commit": "722cceed959e8ac9c45cdfd519a4c387e614c58f",
    "git_tree": "f28c8500c7f4f5223234e87d1b0d2376fbb9539a"
  },
  "identities": {
    "planned_session_id": "s02-5398e11e",
    "planned_worktree_id": "PLACEHOLDER",
    "planned_context_id": "PLACEHOLDER",
    "native_agent_id": "host-observed-unsigned",
    "observed_harness_session_id": "PLACEHOLDER",
    "observed_cwd": "D:\\Github\\Science\\dogfood\\framework-self-study\\experiments\\self-bootstrap-effectiveness-v2\\staging",
    "observed_head_commit": "722cceed959e8ac9c45cdfd519a4c387e614c58f",
    "observed_head_tree": "f28c8500c7f4f5223234e87d1b0d2376fbb9539a"
  },
  "local_evidence": {
    "evidence_level": "host-observed-unsigned",
    "harness_receipt_sha256": null,
    "local_dispatch_acceptance_sha256": null,
    "execution_gate_sha256": null
  },
  "timing": {
    "bootstrap_started_utc": "2026-08-01T17:20:29.220410+00:00",
    "task_received_utc": "2026-08-01T17:20:29.220414+00:00",
    "ended_utc": "2026-08-01T17:20:29.220415+00:00",
    "bootstrap_elapsed_seconds": 0,
    "task_elapsed_seconds": 0
  },
  "task_evidence_started": true,
  "evidence_manifest": {
    "schema_version": 2,
    "attempt_id": "s02-5398e11e",
    "artifacts": [
      {
        "kind": "outputs",
        "path": "s02-5398e11e/outputs.json",
        "sha256": "0df173d0d9d94196d72fe588590313ed68a5c3f2cfae56cb4edbf09c51770208",
        "byte_count": 721
      },
      {
        "kind": "tests",
        "path": "s02-5398e11e/tests.json",
        "sha256": "8182b47324a9910cd47c0d48fa330180daaa1a6a5872a6efa40047ebfcc5a38e",
        "byte_count": 110
      }
    ],
    "manifest_sha256": "78b3f771ae48b63ad47d6e36931265de3a98b09f9ec062b55935ed5e328f4079"
  },
  "stop_reason": "completed",
  "censor": {
    "status": "not-censored",
    "reason": null
  },
  "deviations": [
    "missing-bootstrap-artifacts"
  ],
  "critical_violations": [],
  "finalized_sha256": "a19cf65e214541e3b5973fa23e565f9cc2499a7db362c97664efd1d60ced8244"
}