{
  "schema_version": 2,
  "cohort_id": "self-bootstrap-effectiveness-v2",
  "cell_id": "cs-02-campaign-effort::control",
  "arm": "control",
  "attempt_id": "s07-457c2fad",
  "attempt_ordinal": 1,
  "freeze_sha256": "d4244d161de5765e6aa79212e35fd04d90be1868c3151cbab20c7987a985a7de",
  "allocation_ledger_sha256": "9f2dc4bf2b5a69ddd69940dd7ec77fb352733e0defedc8c1b74e6e2e570421d4",
  "packet_set_sha256": "913d143b628d681a1a959e2eae6d4c41a22f2bb61ff4eaa6ab280e9f07ab6422",
  "subject_packet_sha256": "PLACEHOLDER",
  "baseline": {
    "git_commit": "722cceed959e8ac9c45cdfd519a4c387e614c58f",
    "git_tree": "f28c8500c7f4f5223234e87d1b0d2376fbb9539a"
  },
  "identities": {
    "planned_session_id": "s07-457c2fad",
    "planned_worktree_id": "PLACEHOLDER",
    "planned_context_id": "PLACEHOLDER",
    "native_agent_id": "host-observed-unsigned",
    "observed_harness_session_id": "PLACEHOLDER",
    "observed_cwd": "D:\\Github\\Science\\dogfood\\framework-self-study\\experiments\\self-bootstrap-effectiveness-v2\\staging",
    "observed_head_commit": "722cceed959e8ac9c45cdfd519a4c387e614c58f",
    "observed_head_tree": "f28c8500c7f4f5223234e87d1b0d2376fbb9539a"
  },
  "local_evidence": {
    "evidence_level": "host-observed-unsigned",
    "harness_receipt_sha256": null,
    "local_dispatch_acceptance_sha256": null,
    "execution_gate_sha256": null
  },
  "timing": {
    "bootstrap_started_utc": "2026-08-01T17:24:10.371237+00:00",
    "task_received_utc": "2026-08-01T17:24:10.371240+00:00",
    "ended_utc": "2026-08-01T17:24:10.371241+00:00",
    "bootstrap_elapsed_seconds": 0,
    "task_elapsed_seconds": 0
  },
  "task_evidence_started": true,
  "evidence_manifest": {
    "schema_version": 2,
    "attempt_id": "s07-457c2fad",
    "artifacts": [
      {
        "kind": "outputs",
        "path": "s07-457c2fad/outputs.json",
        "sha256": "98e6668865d7cd710edd71ae29c5cc1fe735fa242be75b88e34c1af05bc7624e",
        "byte_count": 695
      },
      {
        "kind": "tests",
        "path": "s07-457c2fad/tests.json",
        "sha256": "c32ffa5dc062caffa01d2e1f91b07926040f40509a09f00c65d921f8974ad04b",
        "byte_count": 68
      }
    ],
    "manifest_sha256": "3adad9f46e9d6ccc4f02da11671e4ae8243303ca8cc9119d2ba4e1e333ed5f52"
  },
  "stop_reason": "completed",
  "censor": {
    "status": "not-censored",
    "reason": null
  },
  "deviations": [
    "missing-bootstrap-artifacts"
  ],
  "critical_violations": [],
  "finalized_sha256": "6d5c01d52209ad81a7860d6f9c409f231903339442f39a0f8c62fa2b62a1577d"
}