{
  "schema_version": 2,
  "cohort_id": "self-bootstrap-effectiveness-v2",
  "cell_id": "rp-01-lineage-disconnected::control",
  "arm": "control",
  "attempt_id": "s14-bfb25a93",
  "attempt_ordinal": 1,
  "freeze_sha256": "d4244d161de5765e6aa79212e35fd04d90be1868c3151cbab20c7987a985a7de",
  "allocation_ledger_sha256": "9f2dc4bf2b5a69ddd69940dd7ec77fb352733e0defedc8c1b74e6e2e570421d4",
  "packet_set_sha256": "913d143b628d681a1a959e2eae6d4c41a22f2bb61ff4eaa6ab280e9f07ab6422",
  "subject_packet_sha256": "PLACEHOLDER",
  "baseline": {
    "git_commit": "722cceed959e8ac9c45cdfd519a4c387e614c58f",
    "git_tree": "f28c8500c7f4f5223234e87d1b0d2376fbb9539a"
  },
  "identities": {
    "planned_session_id": "s14-bfb25a93",
    "planned_worktree_id": "PLACEHOLDER",
    "planned_context_id": "PLACEHOLDER",
    "native_agent_id": "host-observed-unsigned",
    "observed_harness_session_id": "PLACEHOLDER",
    "observed_cwd": "D:\\Github\\Science\\dogfood\\framework-self-study\\experiments\\self-bootstrap-effectiveness-v2\\staging",
    "observed_head_commit": "722cceed959e8ac9c45cdfd519a4c387e614c58f",
    "observed_head_tree": "f28c8500c7f4f5223234e87d1b0d2376fbb9539a"
  },
  "local_evidence": {
    "evidence_level": "host-observed-unsigned",
    "harness_receipt_sha256": null,
    "local_dispatch_acceptance_sha256": null,
    "execution_gate_sha256": null
  },
  "timing": {
    "bootstrap_started_utc": "2026-08-01T17:20:29.222998+00:00",
    "task_received_utc": "2026-08-01T17:20:29.223001+00:00",
    "ended_utc": "2026-08-01T17:20:29.223002+00:00",
    "bootstrap_elapsed_seconds": 0,
    "task_elapsed_seconds": 0
  },
  "task_evidence_started": true,
  "evidence_manifest": {
    "schema_version": 2,
    "attempt_id": "s14-bfb25a93",
    "artifacts": [
      {
        "kind": "outputs",
        "path": "s14-bfb25a93/outputs.json",
        "sha256": "10fb24f0b5f051e23a3dd611985777b14685482d2064b7b25d17faacab22edb2",
        "byte_count": 745
      },
      {
        "kind": "tests",
        "path": "s14-bfb25a93/tests.json",
        "sha256": "28f0941cb81a8a88aa8b8234b76cf45c217d0541332272c4a8a52e926b14c8f9",
        "byte_count": 105
      }
    ],
    "manifest_sha256": "3ef8af38ed727354b760740b7454e31b2bdd4957c4370c8157f4af2ff5777053"
  },
  "stop_reason": "completed",
  "censor": {
    "status": "not-censored",
    "reason": null
  },
  "deviations": [
    "missing-bootstrap-artifacts"
  ],
  "critical_violations": [],
  "finalized_sha256": "805f2c78a096c6634f0c37cab61d644d4811b01246cd967d0e0f8db46a274533"
}