{
  "schema_version": 2,
  "cohort_id": "self-bootstrap-effectiveness-v2",
  "cell_id": "rp-03-review-record-binding::treatment",
  "arm": "treatment",
  "attempt_id": "s01-951b9571",
  "attempt_ordinal": 1,
  "freeze_sha256": "d4244d161de5765e6aa79212e35fd04d90be1868c3151cbab20c7987a985a7de",
  "allocation_ledger_sha256": "9f2dc4bf2b5a69ddd69940dd7ec77fb352733e0defedc8c1b74e6e2e570421d4",
  "packet_set_sha256": "913d143b628d681a1a959e2eae6d4c41a22f2bb61ff4eaa6ab280e9f07ab6422",
  "subject_packet_sha256": "PLACEHOLDER",
  "baseline": {
    "git_commit": "722cceed959e8ac9c45cdfd519a4c387e614c58f",
    "git_tree": "f28c8500c7f4f5223234e87d1b0d2376fbb9539a"
  },
  "identities": {
    "planned_session_id": "s01-951b9571",
    "planned_worktree_id": "PLACEHOLDER",
    "planned_context_id": "PLACEHOLDER",
    "native_agent_id": "host-observed-unsigned",
    "observed_harness_session_id": "PLACEHOLDER",
    "observed_cwd": "D:\\Github\\Science\\dogfood\\framework-self-study\\experiments\\self-bootstrap-effectiveness-v2\\staging",
    "observed_head_commit": "722cceed959e8ac9c45cdfd519a4c387e614c58f",
    "observed_head_tree": "f28c8500c7f4f5223234e87d1b0d2376fbb9539a"
  },
  "local_evidence": {
    "evidence_level": "host-observed-unsigned",
    "harness_receipt_sha256": null,
    "local_dispatch_acceptance_sha256": null,
    "execution_gate_sha256": null
  },
  "timing": {
    "bootstrap_started_utc": "2026-08-01T17:20:29.220172+00:00",
    "task_received_utc": "2026-08-01T17:20:29.220184+00:00",
    "ended_utc": "2026-08-01T17:20:29.220185+00:00",
    "bootstrap_elapsed_seconds": 0,
    "task_elapsed_seconds": 0
  },
  "task_evidence_started": true,
  "evidence_manifest": {
    "schema_version": 2,
    "attempt_id": "s01-951b9571",
    "artifacts": [
      {
        "kind": "outputs",
        "path": "s01-951b9571/outputs.json",
        "sha256": "b3abdb9cc55ed548a85b18e68c410f6536aeaf693d94d0c0e2c74570c84aa333",
        "byte_count": 776
      },
      {
        "kind": "tests",
        "path": "s01-951b9571/tests.json",
        "sha256": "2e594efd9e3c1a06e6a35fb61daa1a978054d40478dea533478433ad8fadad7e",
        "byte_count": 123
      }
    ],
    "manifest_sha256": "d926b462e00b73e120e573d0baf12282566a856745e849a96c9fbe97e8d71739"
  },
  "stop_reason": "completed",
  "censor": {
    "status": "not-censored",
    "reason": null
  },
  "deviations": [
    "missing-bootstrap-artifacts"
  ],
  "critical_violations": [],
  "finalized_sha256": "510b966b872e1d9d88759beef98a9a4c039f8fa10b829ca83b359011f934371b"
}