{
  "schema_version": 2,
  "cohort_id": "self-bootstrap-effectiveness-v2",
  "cell_id": "rp-03-review-record-binding::control",
  "arm": "control",
  "attempt_id": "s16-aabbb3bc",
  "attempt_ordinal": 1,
  "freeze_sha256": "d4244d161de5765e6aa79212e35fd04d90be1868c3151cbab20c7987a985a7de",
  "allocation_ledger_sha256": "9f2dc4bf2b5a69ddd69940dd7ec77fb352733e0defedc8c1b74e6e2e570421d4",
  "packet_set_sha256": "913d143b628d681a1a959e2eae6d4c41a22f2bb61ff4eaa6ab280e9f07ab6422",
  "subject_packet_sha256": "PLACEHOLDER",
  "baseline": {
    "git_commit": "722cceed959e8ac9c45cdfd519a4c387e614c58f",
    "git_tree": "f28c8500c7f4f5223234e87d1b0d2376fbb9539a"
  },
  "identities": {
    "planned_session_id": "s16-aabbb3bc",
    "planned_worktree_id": "PLACEHOLDER",
    "planned_context_id": "PLACEHOLDER",
    "native_agent_id": "host-observed-unsigned",
    "observed_harness_session_id": "PLACEHOLDER",
    "observed_cwd": "D:\\Github\\Science\\dogfood\\framework-self-study\\experiments\\self-bootstrap-effectiveness-v2\\staging",
    "observed_head_commit": "722cceed959e8ac9c45cdfd519a4c387e614c58f",
    "observed_head_tree": "f28c8500c7f4f5223234e87d1b0d2376fbb9539a"
  },
  "local_evidence": {
    "evidence_level": "host-observed-unsigned",
    "harness_receipt_sha256": null,
    "local_dispatch_acceptance_sha256": null,
    "execution_gate_sha256": null
  },
  "timing": {
    "bootstrap_started_utc": "2026-08-01T17:24:10.373126+00:00",
    "task_received_utc": "2026-08-01T17:24:10.373129+00:00",
    "ended_utc": "2026-08-01T17:24:10.373130+00:00",
    "bootstrap_elapsed_seconds": 0,
    "task_elapsed_seconds": 0
  },
  "task_evidence_started": true,
  "evidence_manifest": {
    "schema_version": 2,
    "attempt_id": "s16-aabbb3bc",
    "artifacts": [
      {
        "kind": "outputs",
        "path": "s16-aabbb3bc/outputs.json",
        "sha256": "2ad9c9fe0a2a263f3012d4ee193f25294c552dd6c8525d0f981b23ccb7ce8cfc",
        "byte_count": 743
      },
      {
        "kind": "tests",
        "path": "s16-aabbb3bc/tests.json",
        "sha256": "ef9f3465d7477e7e85b7d3dbfa7f1e01498a8e3343e62872e803f583b893d267",
        "byte_count": 107
      }
    ],
    "manifest_sha256": "c6d6e14e9978b2231cf6beca76acbc56c9460ca26bf7c4fe14a231ea21d6fc8e"
  },
  "stop_reason": "completed",
  "censor": {
    "status": "not-censored",
    "reason": null
  },
  "deviations": [
    "missing-bootstrap-artifacts"
  ],
  "critical_violations": [],
  "finalized_sha256": "c621d8c15fa858c56b282c102484e34ea9c68df267209d7d37b72a0df4331505"
}