{
  "schema_version": 2,
  "cohort_id": "self-bootstrap-effectiveness-v2",
  "cell_id": "dx-03-doctor-remediation::control",
  "arm": "control",
  "attempt_id": "s03-f067e9a0",
  "attempt_ordinal": 1,
  "freeze_sha256": "d4244d161de5765e6aa79212e35fd04d90be1868c3151cbab20c7987a985a7de",
  "allocation_ledger_sha256": "9f2dc4bf2b5a69ddd69940dd7ec77fb352733e0defedc8c1b74e6e2e570421d4",
  "packet_set_sha256": "913d143b628d681a1a959e2eae6d4c41a22f2bb61ff4eaa6ab280e9f07ab6422",
  "subject_packet_sha256": "PLACEHOLDER",
  "baseline": {
    "git_commit": "722cceed959e8ac9c45cdfd519a4c387e614c58f",
    "git_tree": "f28c8500c7f4f5223234e87d1b0d2376fbb9539a"
  },
  "identities": {
    "planned_session_id": "s03-f067e9a0",
    "planned_worktree_id": "PLACEHOLDER",
    "planned_context_id": "PLACEHOLDER",
    "native_agent_id": "host-observed-unsigned",
    "observed_harness_session_id": "PLACEHOLDER",
    "observed_cwd": "D:\\Github\\Science\\dogfood\\framework-self-study\\experiments\\self-bootstrap-effectiveness-v2\\staging",
    "observed_head_commit": "722cceed959e8ac9c45cdfd519a4c387e614c58f",
    "observed_head_tree": "f28c8500c7f4f5223234e87d1b0d2376fbb9539a"
  },
  "local_evidence": {
    "evidence_level": "host-observed-unsigned",
    "harness_receipt_sha256": null,
    "local_dispatch_acceptance_sha256": null,
    "execution_gate_sha256": null
  },
  "timing": {
    "bootstrap_started_utc": "2026-08-01T17:24:10.370411+00:00",
    "task_received_utc": "2026-08-01T17:24:10.370414+00:00",
    "ended_utc": "2026-08-01T17:24:10.370415+00:00",
    "bootstrap_elapsed_seconds": 0,
    "task_elapsed_seconds": 0
  },
  "task_evidence_started": true,
  "evidence_manifest": {
    "schema_version": 2,
    "attempt_id": "s03-f067e9a0",
    "artifacts": [
      {
        "kind": "outputs",
        "path": "s03-f067e9a0/outputs.json",
        "sha256": "e243f3c19f5a01ca6892a269c7578c12873044efba87325faaf6e4f372a20114",
        "byte_count": 657
      },
      {
        "kind": "tests",
        "path": "s03-f067e9a0/tests.json",
        "sha256": "fbf8a6282e85a647a8141c455dbbc5543d80a8b136817e98f38152a0ebb901ea",
        "byte_count": 93
      }
    ],
    "manifest_sha256": "6ab932abf0b1f1ffe3a7a9c1dcde1eb73b5d12b4a233176accf46d913ea61670"
  },
  "stop_reason": "completed",
  "censor": {
    "status": "not-censored",
    "reason": null
  },
  "deviations": [
    "missing-bootstrap-artifacts"
  ],
  "critical_violations": [],
  "finalized_sha256": "59d00771064cafaf1d8284b0e0a07f8ed1522a8871c5ba0d926b7b365b5be409"
}