{
  "schema_version": 2,
  "cohort_id": "self-bootstrap-effectiveness-v2",
  "cell_id": "cs-03-run-stop-reason::control",
  "arm": "control",
  "attempt_id": "s21-90023977",
  "attempt_ordinal": 1,
  "freeze_sha256": "d4244d161de5765e6aa79212e35fd04d90be1868c3151cbab20c7987a985a7de",
  "allocation_ledger_sha256": "9f2dc4bf2b5a69ddd69940dd7ec77fb352733e0defedc8c1b74e6e2e570421d4",
  "packet_set_sha256": "913d143b628d681a1a959e2eae6d4c41a22f2bb61ff4eaa6ab280e9f07ab6422",
  "subject_packet_sha256": "PLACEHOLDER",
  "baseline": {
    "git_commit": "722cceed959e8ac9c45cdfd519a4c387e614c58f",
    "git_tree": "f28c8500c7f4f5223234e87d1b0d2376fbb9539a"
  },
  "identities": {
    "planned_session_id": "s21-90023977",
    "planned_worktree_id": "PLACEHOLDER",
    "planned_context_id": "PLACEHOLDER",
    "native_agent_id": "host-observed-unsigned",
    "observed_harness_session_id": "PLACEHOLDER",
    "observed_cwd": "D:\\Github\\Science\\dogfood\\framework-self-study\\experiments\\self-bootstrap-effectiveness-v2\\staging",
    "observed_head_commit": "722cceed959e8ac9c45cdfd519a4c387e614c58f",
    "observed_head_tree": "f28c8500c7f4f5223234e87d1b0d2376fbb9539a"
  },
  "local_evidence": {
    "evidence_level": "host-observed-unsigned",
    "harness_receipt_sha256": null,
    "local_dispatch_acceptance_sha256": null,
    "execution_gate_sha256": null
  },
  "timing": {
    "bootstrap_started_utc": "2026-08-01T17:20:29.224420+00:00",
    "task_received_utc": "2026-08-01T17:20:29.224423+00:00",
    "ended_utc": "2026-08-01T17:20:29.224425+00:00",
    "bootstrap_elapsed_seconds": 0,
    "task_elapsed_seconds": 0
  },
  "task_evidence_started": true,
  "evidence_manifest": {
    "schema_version": 2,
    "attempt_id": "s21-90023977",
    "artifacts": [
      {
        "kind": "outputs",
        "path": "s21-90023977/outputs.json",
        "sha256": "dbe820e0ec892ec402c606647eb12164dded8cd83e9a263616525cc58c8a63d3",
        "byte_count": 885
      },
      {
        "kind": "tests",
        "path": "s21-90023977/tests.json",
        "sha256": "34cacf8b8e9a76f807a2bee12a235541e87d72d5e7d3bba05736622d02a5a394",
        "byte_count": 127
      }
    ],
    "manifest_sha256": "45a86dd6576357f6d9c9451a0c0db744c10ed7f094c12148ced0a9a73e011b55"
  },
  "stop_reason": "completed",
  "censor": {
    "status": "not-censored",
    "reason": null
  },
  "deviations": [
    "missing-bootstrap-artifacts"
  ],
  "critical_violations": [],
  "finalized_sha256": "e414de97b41a4edd5acd373084a87c063516e59307850120397b82467d468b5d"
}